"This is such a hard question to answer within a small window. But, I came to Bren so I could (in some way) make the world a better place. I want to focus on water resources and availability as well as convey that importance to people. The Comms Focus will give me the skills I need to explain to people who may not care or understand.",Solo outside journeys have been absolutely necessary for me. I took up running (not a runner) and mountain biking (really NOT a mountain biker). I recently went off Mammoth Mountain in E. California and flew over the handlebars and spent a night in the hospital! It was awful but also super fun! I clearly tried too hard to push myself out of my comfort zone.,"4 Miles (Hilo, HI) and Sano (San Onofre State Beach, CA)"
Obtain a degree to assist me in my next career. Looking forward to learning new skills and information,"Taking care of my parents, teaching classes and summer school, reading environmental books and articles, exercising",Lake in Canada
"explore environmental science, gain skills to enable myself to try to make a positive change",started making water kefir and learning German,an area I went to camp in Malibu
I decided to come to Bren to expand my professional network and looking most forward to making connections with other Brennies during my time here.,"I have been consuming lots of news and political content as we get closer to the election, as well as spending lots of quality time hanging out and playing board games with my family!",The ocean
to gain expertise in the environmental field,puppy foster,Acadia National Park
"I decided to come to Bren because I wanted to change the path I was on and have the tools to find a career that institutes change. I am looking forward to being surrounded by like minded people, and being challenged to push myself academically as well as in internship and job searches.","I have been trying to spend as much time as possible outside: hiking and being at the beach. I started surfing at the beginning of quarantine, so I have been doing a lot of that! I have been listening to more news podcasts & reading a lot!","Big Sur, my family camped there every summer growing up."
"I can to Bren to learn more about conservation practices and how to communicate environmental issues with others. I'm looking forward to learning about this in an interdisciplinary manner, and I am also looking forward to learning from other students.","I started taking a martial arts class over Zoom and I'm trying to teach myself how to rollerskate! Because I've been less busy over quarantine, I've spent a lot more time following the news.",There's a small park by my house where I spent a lot of time as a child.
"I decided to apply and attend Bren because I am wanting to reenter the environmental field and elevate my career. I chose the program because it seems to have a good balance between increasing my technical/scientific foundation that I know I need, with also providing opportunities in the area of business/entrepreneurship which is where I'm interested in pivoting to with my career.","I look back on the past 6 months of Covid and think about how busy it felt at times, but also questioning if there was anything major that I accomplished. For me, a big milestone was figuring out some health issues I've been having that were previously inhibiting my physical activity. I'm grateful I've figured it out what was wrong and I'm finally getting back into shape via cycling, surfing, hiking and yoga. I also took a pre-calculus course to brush up on my math skills. I've also been taking online courses in graphic design, online marketing, and coding to gain some knowledge of areas I previously knew nothing about. Most of my content has been through Coursera (and Shaw Academy - a UK based online learning platform similar to Coursera).",The beach/ocean - or pretty much any body of water. I was learning how to swim before I learned how to walk. Anything I can do to be in or around water makes me really happy :)
It is a well-established program. It has a good focus on learning the science of the environment. I liked the water resources management and corporate environmental management specializations.,"I finished my last semester of my undergrad and spent the summer working. Been trying to keep in touch with my friends and have been working on my current hobbies of golfing, videogames and cooking. I have been consuming mostly social media during quarantine. Watching cable news, or even keeping up with it over social media, makes me sad.",The Fort Bragg coast in Nor Cal.
Contribute to reverse or lessen the current environmental deterioration,,A beach in southern Argentina called Puerto Piramides